{
  "schemaVersion": 1,
  "revision": 1,
  "enterpriseId": "acme-demo",
  "businessProjectId": "20260729-001-deal-conversion",
  "taskId": "deal-task-001",
  "planId": "deal-task-001-plan",
  "planVersion": 1,
  "planSha256": "aaaaaaaaaaaaaaaaaaaaaaaaaaaaaaaaaaaaaaaaaaaaaaaaaaaaaaaaaaaaaaaa",
  "capabilityId": "customer-insight",
  "status": "received",
  "resumeStatus": "",
  "currentStepId": "step-1-customer-insight",
  "evidenceLedgerRevision": 0,
  "candidateVersion": 0,
  "failureCounts": {},
  "lastDiagnosticRef": "",
  "cancelledAt": "",
  "statusHistory": [],
  "updatedAt": "2026-07-29T00:00:00.000Z"
}
